{
  "schema_version": "1.0",
  "bundle_id": "beir-four-corpus-cpu-2026-08",
  "status": "complete",
  "dataset": "scifact",
  "split": "test",
  "arm": "ingest_llm_rerank",
  "public_display_label": "Ingest-time LLM enrichment + Reranking",
  "runner_profile": "bge_m3_rerank_ingest_llm",
  "namespaces": {
    "count": 1,
    "shares_namespaces_with_sibling_arms": true,
    "note": "All arms on this dataset queried this same namespace and therefore the same graph."
  },
  "query_subset": {
    "judged_queries": 300,
    "selected_queries": 300,
    "selection_rule": "judged qrels ids for the split, sorted lexicographically, truncated",
    "sha256": "26cc483d5ed08c9559e5f99948281accbb9aac17b8c2ea6e1e857286d9ebd684"
  },
  "counts": {
    "corpus_docs": 5183,
    "judged_queries": 300,
    "qrels_rows": 339,
    "requested_queries": 300,
    "evaluated_queries": 300,
    "missing_query_text": 0,
    "query_failures": 0
  },
  "metrics": {
    "recall_at_10": 0.8214,
    "ndcg_at_10": 0.6449
  },
  "latency_ms": {
    "mean": 12291.0,
    "p50": 11936.0,
    "p95": 16557.0,
    "min": 8495.0,
    "max": 20607.0,
    "count": 300,
    "definition": "one end-to-end HTTP query per selected query, measured client-side",
    "percentile_algorithm": "index min(n-1, floor(p*n)) on the ascending sample, zero-based; equivalently the (floor(p*n)+1)-th smallest observation, capped at n. This differs from nearest rank (ceil(p*n)-th observation) exactly when p*n is an integer, where it is one observation higher. The published runner computes nearest rank, so a reproduction will differ by at most one observation on the affected percentiles named in this cell's limitations.",
    "comparison_scope": "within_dataset_same_hardware_only"
  },
  "validity": {
    "scientific": {
      "status": "VALID",
      "reason": "Every selected query was evaluated with no missing query text and no request failures."
    },
    "feature_completeness": {
      "status": "PASS",
      "reason": "The arm ran the stages its profile declares; no declared stage was disabled or degraded during the measured pass."
    }
  },
  "hardware": {
    "class": "bare-metal dual-socket server",
    "cpu": "2 x Intel Xeon Silver 4110 (32 cores total)",
    "memory_gb": 187,
    "accelerator": "none",
    "embedding_execution_provider": "cpu",
    "reranker_execution_provider": "cpu"
  },
  "source_locks": {
    "cortrix_core_sha": "79a4eb17c62521338d1ac47a9749e6230e87e69b",
    "public_runner_sha": "9490520c24a96ed97b80073ed3ebab096b80550b",
    "public_runner_content_sha256": "8dd3844ff43ed454bea8b24bf74b317b2fe7654ca289588c6b7447bad638eeb8",
    "public_profiles_content_sha256": "e86f6fab488a70183b1b8540cee548fdcf3033b640d9a57e7e26c336ef79c012",
    "measuring_runner_content_sha256": "6cdf90047078d8b2d512648d74861fb09d107d9598792d64f90d232b32e01b27",
    "runner_profiles_content_sha256": "2dd762cbd22a57388c25ed16fee1c44eed6edf724aef6a55583f1eb1b6203aaf",
    "source_equivalence": "The published runner is a rewrite for publication and is NOT the revision that produced these cells. Neither measuring node ran a committed revision: both ran uncommitted working trees, so the measuring identity is a content hash. The published runner reproduces the same request shape (namespaces always sent as a list), the same deterministic query subset, the same document collapse and the same metrics. Two differences are known and neither affects these cells. First, the published runner counts failed requests, which the measuring runners did not; every cell here recorded zero failures and zero missing query text, so the two behave identically over this data. Second, the published runner computes nearest-rank percentiles while the measuring runners indexed floor(p*n); this changes only p50 and p95, by at most one observation, on the cells each scorecard names in its limitations. The published profiles file has a different content hash from either measuring file, but the five profiles used here -- vector_full, bge_m3_rerank_baseline_v2, bge_m3_rerank_full, bge_m3_rerank_ingest_llm and bge_m3_llm_listwise -- were compared field by field and every retrieval parameter is identical; the differences are comment wording and one diagnostic profile, unused here, that is absent from the published file."
  },
  "protocol": {
    "top_k": 10,
    "retrieval_depth": 50,
    "metric_cutoffs": [
      10
    ],
    "query_mode": "serial, one query at a time",
    "request_timeout_seconds": 300,
    "source_document_id_mapping": "BEIR corpus id from document metadata, de-duplicated by document id at best rank",
    "task_drain": "namespaces ingested in an earlier round; no ingestion during the measured pass"
  },
  "provenance": {
    "measured_window": "2026-08-28/2026-08-31",
    "scope_boundary": "retrieval_quality_only",
    "reingested": false
  },
  "comparability": {
    "prior_bundle": null,
    "prior_cell": null,
    "directly_comparable": false,
    "reason": "No cell in the prior bundle measured this dataset and arm combination."
  },
  "limitations": [
    "Measured at top_k=10 only. Retrieval depth is top_k x 5, so a deeper cutoff would have used a different candidate pool and would not have reproduced these values. Cutoffs beyond 10 are absent rather than estimated.",
    "All arms on this dataset queried the same namespaces, so the arm-to-arm comparison carries no independent-ingest difference.",
    "An unexplained residual of 0.0011 nDCG on NFCorpus and 0.0027 on FiQA survives holding code, configuration, tool and vector graph fixed against an earlier measurement of the same revision. It is about one document in 323 queries. It is disclosed rather than rounded away.",
    "Absolute values are below published dense-retrieval baselines on Quora, and FiQA carries a known loss from the score fusion constant in the measured build. Internal arm-to-arm comparison is valid; the absolute numbers need those boundaries stated before external use.",
    "Published p50 and p95 sit one observation above nearest rank, because p*n is an integer at n=300 and the measuring runner indexed floor(p*n). Per-query samples were not retained, so these values are documented rather than recomputed; the published runner computes nearest rank and will differ by that one observation."
  ],
  "models": {
    "embedding": "bge-m3",
    "reranker": "bge-reranker-v2-m3",
    "format": "ONNX",
    "precision": "fp32",
    "content_sha256": {
      "bge-m3/model.onnx": "6b9d185718f8f8d8420feecfb78c3c6fa2888fda3a1361bbfe1b4e858babb5c1",
      "bge-m3/model.onnx_data": "79d982f5ee30bbbe3d48ca0ab4597144b69891f19523e34af2ee525fba0fbd06",
      "bge-m3/tokenizer.json": "249df0778f236f6ece390de0de746838ef25b9d6954b68c2ee71249e0a9d8fd4",
      "bge-reranker-v2-m3/model.onnx": "faae32b124a9d54afb7e89b5e9896e03c18a9552d56d1d6b273a709a83012486",
      "bge-reranker-v2-m3/model.onnx_data": "f009aa6c6cf21986fd7e0021fa66b20ccce27abc6900a57c7109c8496811bcbe",
      "bge-reranker-v2-m3/tokenizer.json": "8bf8afbfd11306bd872018c53bfdf2e160a56f8edbcf49933324404791c148d3"
    }
  },
  "llm": {
    "ingest_time": {
      "role": "enricher_llm",
      "provider_api": "openai-compatible",
      "model": "deepseek-v4-flash",
      "endpoint": "https://api.deepseek.com"
    },
    "query_time": null
  },
  "arm_config": {
    "rerank": true,
    "llm_rerank": false,
    "route": "complex",
    "rag_fusion": false,
    "llm_rerank_top_n": null,
    "explain": true
  },
  "dataset_archive_sha256": "536e14446a0ba56ed1398ab1055f39fe852686ecad24a6306c80c490fa8e0165"
}
