{
  "schema_version": "1.0",
  "bundle_id": "beir-four-corpus-cpu-2026-08",
  "status": "complete",
  "dataset": "nfcorpus",
  "split": "test",
  "arm": "dense_only",
  "public_display_label": "Dense + BM25, no reranking",
  "runner_profile": "vector_full",
  "namespaces": {
    "count": 1,
    "shares_namespaces_with_sibling_arms": false,
    "note": "This arm queried its own separately ingested namespace, so a comparison against a sibling arm on this dataset also carries the difference between two independently built vector graphs."
  },
  "query_subset": {
    "judged_queries": 323,
    "selected_queries": 323,
    "selection_rule": "judged qrels ids for the split, sorted lexicographically, truncated",
    "sha256": "f3950f7914eaf889ccceeaa0c7d53c787e674db1e442f8fa07ff8d2aec991d44"
  },
  "counts": {
    "corpus_docs": 3633,
    "judged_queries": 323,
    "qrels_rows": 12334,
    "requested_queries": 323,
    "evaluated_queries": 323,
    "missing_query_text": 0,
    "query_failures": 0
  },
  "metrics": {
    "recall_at_10": 0.1495,
    "ndcg_at_10": 0.2991
  },
  "latency_ms": {
    "mean": 656.0,
    "p50": 625.0,
    "p95": 1003.0,
    "min": 466.0,
    "max": 1520.0,
    "count": 323,
    "definition": "one end-to-end HTTP query per selected query, measured client-side",
    "percentile_algorithm": "index min(n-1, floor(p*n)) on the ascending sample, zero-based; equivalently the (floor(p*n)+1)-th smallest observation, capped at n. This differs from nearest rank (ceil(p*n)-th observation) exactly when p*n is an integer, where it is one observation higher. The published runner computes nearest rank, so a reproduction will differ by at most one observation on the affected percentiles named in this cell's limitations.",
    "comparison_scope": "within_dataset_same_hardware_only"
  },
  "validity": {
    "scientific": {
      "status": "VALID",
      "reason": "Every selected query was evaluated with no missing query text and no request failures."
    },
    "feature_completeness": {
      "status": "PASS",
      "reason": "The arm ran the stages its profile declares; no declared stage was disabled or degraded during the measured pass."
    }
  },
  "hardware": {
    "class": "bare-metal dual-socket server",
    "cpu": "2 x Intel Xeon Silver 4110 (32 cores total)",
    "memory_gb": 187,
    "accelerator": "none",
    "embedding_execution_provider": "cpu",
    "reranker_execution_provider": "cpu"
  },
  "source_locks": {
    "cortrix_core_sha": "79a4eb17c62521338d1ac47a9749e6230e87e69b",
    "public_runner_sha": "9490520c24a96ed97b80073ed3ebab096b80550b",
    "public_runner_content_sha256": "8dd3844ff43ed454bea8b24bf74b317b2fe7654ca289588c6b7447bad638eeb8",
    "public_profiles_content_sha256": "e86f6fab488a70183b1b8540cee548fdcf3033b640d9a57e7e26c336ef79c012",
    "measuring_runner_content_sha256": "6824533deedebb14ba5bdfd2978b1adf3249c711135bc7a51aab7fdbe2386a62",
    "runner_profiles_content_sha256": "7eaefe346616083f9927594b6ebc4f904a63b299919a88f40c1a09584bf78e99",
    "source_equivalence": "The published runner is a rewrite for publication and is NOT the revision that produced these cells. Neither measuring node ran a committed revision: both ran uncommitted working trees, so the measuring identity is a content hash. The published runner reproduces the same request shape (namespaces always sent as a list), the same deterministic query subset, the same document collapse and the same metrics. Two differences are known; their effects are bounded and disclosed below. First, the published runner counts failed requests, which the measuring runners did not; every cell here recorded zero failures and zero missing query text, so the two behave identically over this data. Second, the published runner computes nearest-rank percentiles while the measuring runners indexed floor(p*n); this changes only p50 and p95, by at most one observation, on the cells each scorecard names in its limitations. The published profiles file has a different content hash from either measuring file, but the five profiles used here -- vector_full, bge_m3_rerank_baseline_v2, bge_m3_rerank_full, bge_m3_rerank_ingest_llm and bge_m3_llm_listwise -- were compared field by field and every retrieval parameter is identical; the differences are comment wording and one diagnostic profile, unused here, that is absent from the published file."
  },
  "protocol": {
    "top_k": 10,
    "retrieval_depth": 50,
    "metric_cutoffs": [
      10
    ],
    "query_mode": "serial, one query at a time",
    "request_timeout_seconds": 300,
    "source_document_id_mapping": "BEIR corpus id from document metadata, de-duplicated by document id at best rank",
    "task_drain": "namespaces ingested in an earlier round; no ingestion during the measured pass"
  },
  "provenance": {
    "measured_window": "2026-08-28/2026-08-31",
    "scope_boundary": "retrieval_quality_only",
    "reingested": false
  },
  "comparability": {
    "prior_bundle": null,
    "prior_cell": null,
    "directly_comparable": false,
    "reason": "No cell in the prior bundle measured this dataset and arm combination."
  },
  "limitations": [
    "Measured at top_k=10 only. Retrieval depth is top_k x 5, so a deeper cutoff would have used a different candidate pool and would not have reproduced these values. Cutoffs beyond 10 are absent rather than estimated.",
    "Two independently ingested namespaces of the same corpus do not return identical results. Measured this round on NFCorpus with one binary: 0.2991 / 0.1495 against 0.3001 / 0.1524. Roughly 0.001-0.003 nDCG is therefore the floor for any comparison drawn across separate ingests, and differences below it must not be read as effects.",
    "An unexplained residual of 0.0011 nDCG on NFCorpus and 0.0027 on FiQA survives holding code, configuration, tool and vector graph fixed against an earlier measurement of the same revision. It is about one document in 323 queries. It is disclosed rather than rounded away.",
    "Absolute values are below published dense-retrieval baselines on Quora, and FiQA carries a known loss from the score fusion constant in the measured build. Internal arm-to-arm comparison is valid; the absolute numbers need those boundaries stated before external use.",
    "At n=323 neither p*n is an integer, so the published p50 and p95 already equal nearest rank and need no correction."
  ],
  "models": {
    "embedding": "bge-m3",
    "reranker": "bge-reranker-v2-m3",
    "format": "ONNX",
    "precision": "fp32",
    "content_sha256": {
      "bge-m3/model.onnx": "6b9d185718f8f8d8420feecfb78c3c6fa2888fda3a1361bbfe1b4e858babb5c1",
      "bge-m3/model.onnx_data": "79d982f5ee30bbbe3d48ca0ab4597144b69891f19523e34af2ee525fba0fbd06",
      "bge-m3/tokenizer.json": "249df0778f236f6ece390de0de746838ef25b9d6954b68c2ee71249e0a9d8fd4",
      "bge-reranker-v2-m3/model.onnx": "faae32b124a9d54afb7e89b5e9896e03c18a9552d56d1d6b273a709a83012486",
      "bge-reranker-v2-m3/model.onnx_data": "f009aa6c6cf21986fd7e0021fa66b20ccce27abc6900a57c7109c8496811bcbe",
      "bge-reranker-v2-m3/tokenizer.json": "8bf8afbfd11306bd872018c53bfdf2e160a56f8edbcf49933324404791c148d3"
    }
  },
  "llm": null,
  "arm_config": {
    "rerank": false,
    "llm_rerank": false,
    "route": null,
    "rag_fusion": false,
    "llm_rerank_top_n": null,
    "explain": false
  },
  "dataset_archive_sha256": "efe5be03f8c5b86a5870102d0599d227c8c6e2484328e68c6522560385671b0b"
}
